[
  {
    "id": "heijokyo:entity:capital",
    "type": "settlement",
    "labels": { "ja": "平城京" },
    "description": { "ja": "710年に築かれた古代の都城。表示範囲は粗い概略です。" }
  },
  {
    "id": "heijokyo:entity:palace",
    "type": "archaeological-site",
    "labels": { "ja": "平城宮" },
    "description": { "ja": "平城京の中心部に置かれた宮。表示位置は代表点です。" }
  },
  {
    "id": "heijokyo:entity:suzaku-avenue",
    "type": "route",
    "labels": { "ja": "朱雀大路" },
    "description": { "ja": "平城宮の南正門から南へ延びる都の中心軸。表示線は概略です。" }
  },
  {
    "id": "heijokyo:entity:capital-boundary",
    "type": "boundary",
    "labels": { "ja": "平城京の条坊都市域（概略境界）" },
    "description": { "ja": "奈良市の説明する内京と外京の関係を、都市域の仮説境界として示します。発掘で確定した羅城・行政境界・現代の規制区域ではありません。" }
  }
]
