[
  {
    "description": {
      "ja": "上町台地が半島のように突き出し、その東側に河内湾・河内湖が広がったという関係を読むための概略線です。古代の正確な海岸線・潮間帯・水深を復元しません。"
    },
    "id": "osaka:entity:ancient-coastline",
    "labels": {
      "ja": "河内湾・古代海岸線（概略）"
    },
    "type": "coastline"
  },
  {
    "description": {
      "ja": "1533年に開山され1580年に退去した石山（大坂）本願寺を、現在の大阪城付近の代表点で示します。寺域・濠・土居の精密な境界ではありません。"
    },
    "id": "osaka:entity:ishiyama-honganji",
    "labels": {
      "ja": "石山（大坂）本願寺（代表点）"
    },
    "type": "fortification"
  },
  {
    "description": {
      "ja": "濠や土居に囲まれた寺内町を、上町台地北端の集住・活動域として概略表示します。町割・屋敷・道路・境界の精密復元ではありません。"
    },
    "id": "osaka:entity:ishiyama-teramachi",
    "labels": {
      "ja": "石山本願寺寺内町（概略）"
    },
    "type": "settlement"
  },
  {
    "description": {
      "ja": "大阪湾から上町台地の東側へ入り込んだ古代の水域を、資料の地形説明を読むための概略面で示します。古代の正確な海岸線・水深・水面ではありません。"
    },
    "id": "osaka:entity:kawachi-bay",
    "labels": {
      "ja": "河内湾・河内湖（古代の概略）"
    },
    "type": "waterbody"
  },
  {
    "description": {
      "ja": "天満橋から北浜南岸付近にあったと説明される渡辺津を、古代・中世の水運文脈を読む代表点で示します。港域・岸線・船着場・航路の精密な位置ではありません。"
    },
    "id": "osaka:entity:watanabe-port",
    "labels": {
      "ja": "渡辺津（代表点）"
    },
    "type": "port"
  },
  {
    "description": {
      "ja": "淀川を上ることで京都へつながる水運の関係を、現在地図上の概略線で示します。歴史的な河道中心線・航路・距離ではありません。"
    },
    "id": "osaka:entity:yodo-watercourse",
    "labels": {
      "ja": "淀川水運（概略）"
    },
    "type": "watercourse"
  }
]
