[
  {
    "description": {
      "ja": "安土山に築かれた織田信長の居城。表示位置は代表点で、城郭全体の境界ではありません。"
    },
    "id": "azuchijo:entity:castle",
    "labels": {
      "ja": "安土城"
    },
    "type": "fortification"
  },
  {
    "description": {
      "ja": "安土が琵琶湖東岸に位置することを示す概略線。現在・過去の正確な湖岸線ではありません。"
    },
    "id": "azuchijo:entity:lakeshore",
    "labels": {
      "ja": "琵琶湖東岸（安土付近）"
    },
    "type": "coastline"
  },
  {
    "description": {
      "ja": "安土城が築かれた山。表示位置は安土城との相対関係を見るための代表点です。"
    },
    "id": "azuchijo:entity:mountain",
    "labels": {
      "ja": "安土山"
    },
    "type": "archaeological-site"
  },
  {
    "description": {
      "ja": "安土城と琵琶湖東岸を結ぶ水運の文脈を考えるための概略接続線。実際の航路・港・船着場の位置ではありません。"
    },
    "id": "azuchijo:entity:water-transport",
    "labels": {
      "ja": "安土城と湖上交通の関係（概略）"
    },
    "type": "route"
  }
]
