[
  {
    "id": "azuchijo:entity:castle",
    "type": "fortification",
    "labels": { "ja": "安土城" },
    "description": { "ja": "安土山に築かれた織田信長の居城。表示位置は代表点で、城郭全体の境界ではありません。" }
  },
  {
    "id": "azuchijo:entity:mountain",
    "type": "archaeological-site",
    "labels": { "ja": "安土山" },
    "description": { "ja": "安土城が築かれた山。表示位置は安土城との相対関係を見るための代表点です。" }
  },
  {
    "id": "azuchijo:entity:lakeshore",
    "type": "coastline",
    "labels": { "ja": "琵琶湖東岸（安土付近）" },
    "description": { "ja": "安土が琵琶湖東岸に位置することを示す概略線。現在・過去の正確な湖岸線ではありません。" }
  },
  {
    "id": "azuchijo:entity:water-transport",
    "type": "route",
    "labels": { "ja": "安土城と湖上交通の関係（概略）" },
    "description": { "ja": "安土城と琵琶湖東岸を結ぶ水運の文脈を考えるための概略接続線。実際の航路・港・船着場の位置ではありません。" }
  },
  {
    "id": "azuchijo:entity:omi-sphere",
    "type": "sphere-of-influence",
    "labels": { "ja": "織田信長の近江支配の拠点網（概略）" },
    "description": { "ja": "琵琶湖岸の拠点城郭から近江全体を支配する構想を考えるための概略範囲。行政境界・確定した国境・実効支配の精密な面ではありません。" }
  },
  {
    "id": "azuchijo:entity:omi-polity",
    "type": "polity",
    "labels": { "ja": "織田信長の近江支配・安土政治中枢（概略）" },
    "description": { "ja": "安土城を中心に近江支配を担った政治的中枢の概略範囲。近江全域の行政境界・国境・実効支配の精密な面ではありません。" }
  }
]
