[
  {
    "description": {
      "ja": "巨椋池干拓工事の完成を記念して建立された碑。"
    },
    "id": "ogurike:entity:reclamation-monument",
    "labels": {
      "ja": "巨椋池干拓之碑"
    },
    "type": "other"
  },
  {
    "description": {
      "ja": "巨椋池周辺の河川工事前後を資料スナップショットで示す水系。"
    },
    "id": "ogurike:entity:ujigawa",
    "labels": {
      "ja": "宇治川"
    },
    "type": "watercourse"
  },
  {
    "description": {
      "ja": "京都盆地南部にかつて存在した池沼。国土交通省の変遷図にある1590年・1596年・1885年・1910年・1933年の相対的な水域範囲を、時点ごとの概略面として示す。精密な境界や面積ではない。"
    },
    "id": "ogurike:entity:waterbody",
    "labels": {
      "ja": "巨椋池"
    },
    "type": "waterbody"
  }
]
